{
  "correlationID": "55555555-5555-4555-8555-555555555555",
  "deviceID": "44444444-4444-4444-8444-444444444444",
  "epoch": 3,
  "messageID": "22222222-2222-4222-8222-222222222222",
  "messageKind": "vaultCommitted",
  "payload": {
    "mode": "recordingOnly",
    "verifiedArtifactHash": "1111111111111111111111111111111111111111111111111111111111111111"
  },
  "protocolVersion": 1,
  "recordingID": "11111111-1111-4111-8111-111111111111",
  "replayRule": "idempotent",
  "revision": 3,
  "senderInstallationID": "33333333-3333-4333-8333-333333333333"
}
